,title,company,city,work_mode,min_experience_years,description,skill_1,skill_2,skill_3,skill_4,skill_5,skill_6,skill_7,nice_to_have_1,nice_to_have_2,education_level_1,specialization_1,specialization_2,specialization_3,tool_1,tool_2,tool_3,responsibility_1,responsibility_2,responsibility_3,skill_8,skill_9,skill_10,specialization_4,specialization_5,specialization_6,tool_4,tool_5,tool_6,skill_11,skill_12,skill_13,nice_to_have_3,tool_7,responsibility_4,education_level_2,Unnamed: 0,Position,Company,Location,Work Mode,Description
0,Gen AI Engineer Job Description,N/A,N/A,Full-time/Part-time,3,"This role is ideal for someone passionate about LLMs, fine-tuning models, and building AI-driven solutions at scale.",LLMs,Generative AI,LangChain,Python,Vertex AI,Data engineering,Model evaluation,Agentic AI,GenAI frameworks,"$50,000-$80,000",Healthcare domain,Production workflows,Enterprise systems,Google Vertex AI,LangChain,Open-source frameworks,"Design and develop AI solutions using LLMs, Generative AI models, and tools.","Build and manage pipelines for training, fine-tuning, and deploying models.",Integrate AI models into production workflows and enterprise systems.,,,,,,,,,,,,,,,,,0,Gen AI Engineer,Rivago Infotech Inc,Canada,Remote,"About the job
Job Description:
We are seeking a Gen AI Engineer to join an innovative team working on cutting-edge Generative AI projects within the healthcare domain. This role is ideal for someone passionate about LLMs, fine-tuning models, and building AI-driven solutions at scale.
Key Responsibilities:
Design and develop AI solutions using LLMs, Generative AI models, and tools such as LangChain.
Build and manage pipelines for training, fine-tuning, and deploying models using platforms like Google Vertex AI and open-source frameworks.
Integrate AI models into production workflows and enterprise systems.
Evaluate and optimize pre-trained models (e.g., GPT, BERT) for various business use cases.
Perform data preprocessing, hyperparameter tuning, and model performance optimization.
Collaborate with cross-functional teams including data scientists, engineers, and product managers.
Document system architectures, workflows, and technical decisions for both technical and business audiences.
Stay current with advancements in LLMs, Agentic AI, and GenAI frameworks.
Research and experiment with new techniques to enhance solution quality and performance.
Required Skills & Experience:
Hands-on experience with LLMs and Generative AI (e.g., GPT, BERT).
Proficiency in building pipelines using platforms like Vertex AI or similar.
Strong programming skills in Python and experience with LangChain or similar frameworks.
Experience integrating AI into enterprise or production-level systems.
Solid understanding of data engineering principles and model evaluation.
Excellent communication skills and ability to work in collaborative environments."
1,Gen AI Engineer Job Description,Insilico Medicine,Montreal,,5,"About the job We are seeking a Gen AI Engineer to join an innovative team working on cutting-edge Generative AI projects within the healthcare domain. This role is ideal for someone passionate about LLMs, fine-tuning models, and building AI-driven solutions at scale.",LLMs,Generative AI,LangChain,Google Vertex AI,Deep Learning,Machine Learning,Python programming,Knowledge of chemistry and biology,,Master's degree,NLP tasks within the biomedical and materials science domains,Text classification,"Information extraction from abstracts, patents, and clinical trials",LangChain,DeepSpeed,FSDP,"Design and develop AI solutions using LLMs, Generative AI models, and tools.","Build and manage pipelines for training, fine-tuning, and deploying models.",,Data preprocessing,Hyperparameter tuning,Model performance optimization,Multi-task learning,Knowledge graph construction,Fine-tuning large language models (LLMs),Megatron-LM,,,,,,,,,,1,NLP Engineer,Insilico Medicine,,,"About the job
About Insilico 
Insilico Medicine is an end-to-end, artificial intelligence (AI) -driven pharma- biotechnology company with a mission to accelerate drug discovery and development by leveraging our rapidly evolving, proprietary platform across biology, chemistry, and clinical development. 
For more info, visit our website https://insilico.com 

About Role 
Insilico Medicine is looking for a Machine Learning Engineer specializing in Natural Language Processing (NLP) tasks within the biomedical and materials science domains. The role focuses on areas such as text classification, information extraction from abstracts, patents, and clinical trials, multi-task learning, knowledge graph construction, and fine-tuning large language models (LLMs) for chemical and biomedical applications. 

Place of work 

3710-1250 René-Lévesque West Boulevard, Montreal,QC-H3B 4W8,Canad

Reports to 

NLP Team Lead (AI R&D) 

Responsibilities 
Fine-tune and optimize Large Language Models on domain-specific or custom datasets. 
Analyze errors, identify system limitations, and propose enhancements. 
Search and review state-of-the-art solutions and new datasets for NLP tasks. 
Design scalable and maintainable engineering solutions inspired by the latest research and innovation. 
Translate academic innovation into scalable, maintainable engineering solutions. 
Build and curate datasets using annotation tools, distant supervision, and expert annotations. 
Collaborate closely with clients and internal stakeholders to align research-driven initiatives with business needs. 

General Requirements: 
I. Education 

Master’s degree or PhD in Computer Science, Machine Learning, or a related field. 
II. Experience and Skills 

5+ years of hands-on experience in NLP, Machine Learning, and Deep Learning. 
Strong understanding of Machine Learning, Deep Learning and AI. 
Strong proficiency in Python programming. 
Motivation to learn new things and apply creative solutions. 
Hands-on experience in scaling and optimizing large language model (LLM) training and fine-tuning, including multi-GPU/multi-node setups. 
Familiarity with frameworks like DeepSpeed, FSDP, Megatron-LM, or equivalent. 
Ability to diagnose and resolve performance bottlenecks in distributed training. 
Experience fine-tuning LLMs (e.g. GPT, LLaMA, Mistral) on custom or domain-specific datasets. 

Desirable skills: 
Knowledge of chemistry and biology, particularly for domain-specific NLP applications in life sciences. 
Familiarity with Reinforcement Learning concepts and frameworks. 

Personal Attributes: 
Motivation to explore and apply creative, cutting-edge solutions. 
Strong communication and collaboration skills. 
Ability to work independently in a dynamic, fast-paced environment."
2,Job Description,,,,5,"Job Description: We are seeking a Gen AI Engineer to join an innovative team working on cutting-edge Generative AI projects within the healthcare domain. This role is ideal for someone passionate about LLMs, fine-tuning models, and building AI-driven solutions at scale.",LLMs,Generative AI,Python,LangChain,Vertex AI,,,chemistry and biology,Reinforcement Learning concepts,Master's degree or PhD,NLP,Machine Learning,,DeepSpeed,FSDP,Megatron-LM,"Design and develop AI solutions using LLMs, Generative AI models, and tools like LangChain.","Build and manage pipelines for training, fine-tuning, and deploying models using platforms like Google Vertex AI and open-source frameworks.",,,,,,,,OpenAI,LangSmith,Pydantic,,,,,,,,2,AI Engineer,Ares,,,"About the job
About Ares
The Problem
Personal injury (PI) law is a $50+ B industry starved for technology. Every case spawns mountains of medical records and time-sucking documents that slow justice for the injured.

Our Solution
Ares flips the script. Our AI engine already turns raw medical records into a crystal-clear medical summaries in minutes and drafts legal documents that get insurers moving. 

By using Ares, firms get:
99% reduction in medical records review
Increase revenue by 20% without additional headcount
Get justice for victims, faster

Our Mission
Our current platform is just chapter one. We’re racing toward a future where every repetitive task in PI law is eliminated via AI automation—globally.

Founded by an ex-Meta tech lead (YC & Antler alum) who’s shipped products to billions, we’re profitable, trusted by firms across the US, and backed by furious customer pull.

About the Role
You’ll be the first engineering hire and technical counterpart to the founder. Our job: turn Ares into the AI operating system for every personal injury firm on earth. Expect full ownership of architecture, code, infra, and product decisions—because there’s nobody to “hand work off” to yet.

What you’ll do:
Own major features end-to-end: API design, backend logic, frontend UI, and everything in between
Productionize LLM workloads (RAG, evals, fine-tuning) at scale.
Work closely with customers to understand what matters, then ship fast
Help shape our engineering culture, system architecture, and technical roadmap
Solve real problems for real businesses, not imaginary ones

The ideal candidate:
Has built and shipped meaningful software at high-growth startups or tech-forward companies
Hands-on with LLMs (prompt engineering, RAG, evals, fine-tuning).
Understands tradeoffs, knows when to move fast, and when to polish
Doesn’t need permission to start something, but knows when to ask for input
Wants to own real outcomes—not just code
Thrive in an on-site, 6-days a week, “ship-it-today” environment

Why join us:
Competitive compensation, with generous founding equity. This also means that we expect a lot from you.
Build on a once-in-a-generation AI wave and see direct customer impact every week.
Clear path to senior leadership as we scale engineering.
Thrive in a high-energy, six-day in-office environment - constant white-board jams, instant feedback loops, and Friday demos followed by happy hour.
Achieve explosive personal and professional growth while we build Ares into a unicorn. 

Our Stack
Backend: Python, Flask 
Frontend: React/Next.JS, TypeScript, Tailwind
Infra: AWS, Supabase, Railway 
AI: OpenAI, LangSmith, Pydantic

Interview Process
The entire process has 4 steps and takes around 1.5 week in total:
Initial 15-30 minute phone screening interview.
One 30-45 minute technical interview.
One week fully-paid work trial.
Full-time offer.

You'll be working with the founders directly throughout the entire process."
3,Job Descriptions,Insilico Medicine,Montreal,Full-time,5,"About the job

We are seeking a Gen AI Engineer to join an innovative team working on cutting-edge Generative AI projects within the healthcare domain. This role is ideal for someone passionate about LLMs, fine-tuning models, and building AI-driven solutions at scale.
Key Responsibilities:
Design and develop AI solutions using LLMs, Generative AI models, and tools such as LangChain.
Build and manage pipelines for training, fine-tuning, and deploying models using platforms like Google Vertex AI and open-source frameworks.
Integrate AI models into production workflows and enterprise systems.
Evaluate and optimize pre-trained models (e.g., GPT, BERT) for various business use cases.
Perform data preprocessing, hyperparameter tuning, and model performance optimization.
Collaborate with cross-functional teams including data scientists, engineers, and product managers.
Document system architectures, workflows, and technical decisions for both technical and business audiences.
Stay current with advancements in LLMs, Agentic AI, and GenAI frameworks.
Research and experiment with new techniques to enhance solution quality and performance.","LLMs (GPT, BERT)",LangChain,Python,Vertex AI,,,,"Familiarity with frameworks like DeepSpeed, FSDP, Megatron-LM",Knowledge of chemistry and biology,Master's degree,NLP tasks,"LLMs (GPT, LLaMA, Mistral) on custom or domain-specific datasets",,Google Vertex AI,open-source frameworks,Flask,"Design and develop AI solutions using LLMs, Generative AI models,",,,,,,,,,React/Next.JS,TypeScript,Tailwind,,,,,,,,3,Artificial Intelligence Software Developer,MaintainX,,,"About the job
MaintainX is the world's leading Asset and Work Intelligence platform for industrial and frontline environments. We are a modern IoT-enabled cloud-based tool for reliability, safety, and operations on physical equipment and facilities. MaintainX powers operational excellence for 10,000+ businesses including Duracell, Univar Solutions Inc., Titan America, McDonald's, Brenntag, Cintas, Xylem, and Shell.

We've raised $104 million in venture capital following a recent Series C funding round led by Bain Capital Ventures, Bessemer Ventures, August Capital, Amity Ventures, Ridge Ventures as well as CEO’s from GE, Twilio, Coupa, Toast and PagerDuty.

We're looking for a Software Engineer with experience building AI-powered applications leveraging LLMs. You’ll design and deploy intelligent features that integrate with web apps and backend systems. You’ll work closely with product and engineering teams to build scalable, production-ready solutions. This role blends hands-on full-stack development with cutting-edge AI capabilities.

What You’ll Do

Design, develop, and deploy AI-powered applications utilizing LLMs and other models to solve complex business problems.
Ensure seamless integration of AI models with web applications and backend services.
Implement and optimize algorithms for performance and scalability, ensuring efficient end-to-end solutions.
Collaborate with product managers, designers, and engineers to define product requirements and integrate AI capabilities into customer-facing applications.
Contribute to engineering best practices, including code quality, security, and deployment processes.
Participate in on-call duties.

About You

Proven experience implementing LLM-powered applications, including prompt engineering, retrieval mechanisms, agentic workflows and integrating external knowledge sources.
3+ years of professional experience in full-stack software development, including 1+ year of experience working with LLMs.
Strong programming skills in Python and/or JavaScript/TypeScript, with experience using LLM frameworks such as LlamaIndex, LangChain and LangGraph.
Experience with cloud providers (AWS/Azure/GCP) and deploying AI services at scale.
Knowledge of modern web development frameworks (React, Node.js) and API design.
Strong problem-solving skills, with the ability to design scalable AI-powered solutions.
Excellent communication skills to explain complex AI concepts to non-technical stakeholders.
Actively keeps up with recent advancements in LLMs and AI, including new models, tools, and industry trends.

Bonus Skills

Built multi-modal applications.
Implemented guardrails and evaluation pipelines for LLM-driven applications.
Skilled in training, fine-tuning, optimizing, and deploying language models.

What’s In It For You

Competitive salary and meaningful equity opportunities.
Healthcare, dental, and vision coverage.
401(k) / RRSP enrollment program.
Take what you need PTO.
A Work Culture where:
You’ll work alongside folks across the globe that reflect the MaintainX values: Smart Humble Optimists.
We believe in meritocracy, where ideas and effort are publicly celebrated.
About Us

Our mission is to make the lives of blue-collar workers easier worldwide by creating software that meets their needs and realities. Our product is truly life-changing for that 80% of the workforce who doesn’t work behind a desk and needs enterprise-grade software at their fingertips.

MaintainX is committed to creating a diverse environment. All qualified applicants will receive consideration for employment without regard to race, color, religion, gender, gender identity or expression, sexual orientation, national origin, genetics, disability, age, or veteran status."
4,Extracted Data,Insilico Medicine,Montreal,Full-time,5,Seeking a Gen AI Engineer to join an innovative team working on cutting-edge Generative AI projects within the healthcare domain.,Python,LLMs,Generative AI,,,,,Chemistry and biology knowledge,Reinforcement Learning experience,Master's degree or PhD,Text classification,Information extraction,Multi-task learning,LangChain,Google Vertex AI,OpenAI,"Design and develop AI solutions using LLMs, Generative AI models, and tools","Build and manage pipelines for training, fine-tuning, and deploying models",,,,,Knowledge graph construction,,,,,,,,,,,,,4,AI Adoption Specialist / AI Enablement Consultant,Confidential,"Montreal, QC",Hybrid,"About the job
About Us
We’re a fast-growing AI services firm dedicated to helping organizations harness the power of artificial intelligence. We partner with clients across industries to upskill their teams through engaging, practical training—both live online and in-person. As we expand our offerings, we’re looking for passionate AI Trainers to join our team and deliver transformative learning experiences.
What You’ll Do
Work alongside our specialists and client representatives to evaluate training requirements.
Design & develop curriculum, creating comprehensive, role-based modules on AI fundamentals, prompt engineering, and real-world tool integration.
Deliver interactive training, leading live virtual classes via Zoom, Teams, or proprietary platforms—using polls, breakout rooms, and hands-on exercises to maximize engagement.
Facilitate in-person workshops at client sites, applying case-study methodology and live demos to deepen practical understanding.
Produce supporting materials such as slide decks, quick-reference guides, video tutorials, and follow-up exercises to reinforce learning outcomes.
Measure & report on success, defining key metrics (e.g., pre-/post-training assessments, user satisfaction scores) and delivering succinct ROI reports to clients.
Stay current & share knowledge, updating content with the latest AI advancements and mentoring junior trainers to build organizational expertise.
What We’re Looking For
Educational Background: Bachelor’s degree in Computer Science, Data Science, Education, or a related field.
Training Experience: 2+ years designing and delivering corporate training or workshops—ideally in AI, machine learning, or advanced analytics.
Technical Proficiency: Hands-on familiarity with AI platforms (e.g., OpenAI/GPT, Azure AI, AWS SageMaker) and core ML concepts.
Facilitation Skills: Exceptional verbal and written communication with the ability to simplify complex topics and troubleshoot live both online and in person.
Personal Attributes:
Strong consultative mindset and client-service orientation
Adaptability and proactive learning of emerging AI trends
Willingness to travel to deliver onsite workshops as needed
Why Join Us?
Impact: Enable professionals to transform workflows and drive measurable business value with AI.
Variety: Engage with clients across sectors—from finance and healthcare to manufacturing and retail.
Growth: Access ongoing professional development, peer mentoring, and exposure to cutting-edge AI projects.
Flexibility: Balanced mix of virtual and on-site assignments, with support for work-life integration.
How to Apply
Please submit your resume outlining your training experience and why you’re passionate about AI education. We look forward to learning how you can help shape the future of work through AI-powered learning!
Job Types: Part-time, Fixed term contract

Work Location: Hybrid remote in Montréal, QC"
