,title,company,city,work_mode,min_experience_years,description,skill_1,skill_2,skill_3,skill_4,skill_5,skill_6,skill_7,nice_to_have_1,nice_to_have_2,education_level_1,specialization_1,specialization_2,specialization_3,tool_1,tool_2,tool_3,responsibility_1,responsibility_2,responsibility_3,skill_8,skill_9,skill_10,specialization_4,specialization_5,specialization_6,tool_4,tool_5,tool_6,skill_11,skill_12,skill_13,nice_to_have_3,tool_7,responsibility_4,education_level_2,Unnamed: 0,Position,Company,Location,Work Mode,Description
5,Job Descriptions,,,Full-time,5,"Design and develop AI solutions using LLMs, clean, transform, and preprocess time series data, build, train, and evaluate forecasting models, create clear and compelling visualizations.",Python,LLMs,Generative AI,LangChain,Google Vertex AI,Reinforcement Learning,Data Engineering,Control and optimization of modern power and energy systems,"Optimization techniques such as linear programming, integer programming",Master's degree,Genetic AI,NLP tasks,Biomedical applications,Flask,React/Next.JS,TypeScript,Design and develop AI solutions using LLMs,"Clean, transform, and preprocess time series data","Build, train, and evaluate forecasting models",Machine Learning,Deep Learning,NLP,Materials science domain,,,Tailwind,AWS,Supabase,OpenAI,Azure AI,AWS SageMaker,Machine learning model deployment strategies and monitoring techniques,Railway,Create clear and compelling visualizations,,5,AI Engineer,BluWave-ai,,,"About the job
Are you ready to make a real impact on the world? Join our mission-driven team at the cutting edge of artificial intelligence and sustainable energy.

At BluWave-ai, we’re harnessing AI-driven solutions to accelerate the adoption of clean energy, build smarter grids, and drive the electrification of transportation. If you're excited about using technology to create a greener, more efficient future, this is the place for you!

Here, entrepreneurial mindsets thrive, career growth is nurtured, and your work directly contributes to a sustainable future. If you're eager to shape the next generation of renewable energy, we want you on our team.

If you’re ready to be part of something bigger, join us and help power a cleaner tomorrow!

What You’ll Do

Develop and implement advanced time series forecasting models to predict future trends, demand, and other relevant variables. Apply techniques such as ARIMA, SARIMA, exponential smoothing, or machine learning algorithms tailored to time series data
Clean, transform, and preprocess time series data to ensure data integrity and quality. Handle missing data, outliers, and other data anomalies appropriately
Identify and engineer relevant features to improve the accuracy and performance of forecasting models. Incorporate domain knowledge to enhance feature selection and extraction
Build, train, and evaluate forecasting models using appropriate evaluation metrics. Select and fine-tune models to achieve optimal performance
Continuously monitor and validate the accuracy and performance of forecasting models over time. Identify and address issues related to model drift or degradation
Collaborate with cross-functional teams, including stakeholders from different departments, to understand business requirements and provide actionable insights based on time series analysis and optimization
Create clear and compelling visualizations, reports, and dashboards to effectively communicate forecasting results, optimization recommendations, and key insights to both technical and non-technical stakeholders
Stay updated with the latest advancements in time series forecasting, optimization techniques, and related domains. Explore, research and develop innovative approaches to improve forecasting accuracy and optimization outcomes

What You Bring

Must Have

Bachelor's or Master's degree in Computer Science, Statistics, Mathematics, or a related field
3 years of experience in data science or a related field, with a focus on time series forecasting and optimization
Knowledge and hands-on experience in developing time series forecasting models using statistical and machine learning approaches
Programming Skills: Proficiency in Python for data manipulation, analysis, and model development
Analytical Skills: Ability to apply mathematical concepts and statistical techniques to analyze complex time-dependent data and derive actionable insights
Proficiency in data visualization and dashboarding tools like Grafana, Plotly, or similar
Excellent verbal and written communication skills for presenting complex concepts and findings
Proven ability to collaborate effectively in cross-functional teams
Continuous Learning: Strong desire to stay updated with advancements in data science, time series forecasting, and optimization
You are a pragmatic innovator who thrives in a fast-paced, disciplined, and team-oriented environment where we strive individually while supporting, learning from, and building on each other's ideas and efforts to succeed as a team

Nice-to-Have

Familiarity with control and optimization of modern power and energy systems
Experience with optimization techniques such as linear programming, integer programming, and related tools (e.g. Pyomo, Gurobi, CPLEX)
Understanding of machine learning model deployment strategies and monitoring techniques
Familiarity with Kubeflow, MLflow, or similar for managing and deploying machine learning models
Experience with Azure, AWS, or Google Cloud Platform and their machine learning services
Knowledge of Apache Hadoop, Spark, or Hive and experience with large-scale time series datasets
Familiarity with InfluxDB, Prometheus, or TimescaleDB for efficient time series data storage
Experience with Git or similar version control tools for collaborative development

Why Join Us?

At BluWave-ai, we believe in taking care of our team just as much as we care about the planet. Here’s what you can look forward to:

Work Your Way – Enjoy the flexibility of a hybrid work model, balancing remote and in-office collaboration
Prioritize Your Well-Being – Take unlimited sick days because your health always comes first
Recharge & Refresh – Start with two weeks of paid time off, increasing to three weeks after your second year
Tailored Benefits – Choose from flexible employee benefit packages designed to fit your lifestyle
Grow with Us – Share in our success with employee stock options
Work Comfortably – Our relaxed dress code lets you be yourself
Stay Active & Healthy – Take advantage of corporate gym rates and wellness reimbursements to support your fitness goals
Invest in Your Future – After five years with us, take a well-earned sabbatical to recharge, explore, or pursue personal growth

Diversity makes us stronger. BluWave-ai provides equal employment opportunities to all employees and applicants without regard to race, color, religion, sex, gender, national origin, disability, or any other characteristic protected by applicable laws, regulations, or ordinances. BluWave-ai’s core purpose is to facilitate the transition to a sustainable future with our technology. We live by that ethos and all corporate decision making considers the environmental impact.

Authorization to work in Canada is required for this position. We encourage all levels of experience to apply.

Powered by JazzHR

cIfkGfhHJF"
6,Top 10 AI Jobs in High Demand,Various Companies,Remote/ Various Cities,Full-time,2,"Join the cutting-edge team at EY, where you'll have the chance to build a career as unique as you are, with the global scale, support, inclusive culture and technology to become the best version of you. Our team of experts is dedicated to creating innovative solutions that drive business value and improve people's lives.",Machine Learning,Deep learning,Natural Language Processing,Computer Vision,,,,Familiarity with Large Language Models,Experience with testing tools such as DeepChecks,Bachelor's degree,Data Science,AI Engineering,Business Intelligence,Python,Tensorflow,PyTorch,Collaborate with cross-functional teams to translate requirements in robust AI solutions integrating without client's technology stack.,"Test new AI tools, platforms, technologies and techniques.",,,,,,,,Scikit-learn,Grafana,Plotly,,,,,,,Master's degree,6,AI and Data - Senior Consultant - AI/ML Engineer - Ottawa,EY,,,"About the job
At EY, you’ll have the chance to build a career as unique as you are, with the global scale, support, inclusive culture and technology to become the best version of you. And we’re counting on your unique voice and perspective to help EY become even better, too. Join us and build an exceptional experience for yourself, and a better working world for all.

The opportunity

Your Key Responsibilities

Collaborate with our client stakeholders to understand use cases and key business processes that the AI solutions will support.
Work closely with cross-functional teams, architects, engineers to translate requirements in robust AI solutions integrating without client’s technology stack
Continuously learn, experiment, and test new AI tools, platforms, technologies, and techniques.
Create comprehensive test plans for AI-based applications, covering functional, performance, security, and ethical considerations

Skills And Attributes For Success.

Strong problem-solving skills and the ability to think creatively to overcome obstacles.
Ability to work independently with minimal supervision.
Excellent communication and interpersonal skills, with the ability to work collaboratively with both technical and non-technical stakeholders.
Excellent time management and organizational skills, with the ability to prioritize competing demands effectively.

To qualify for the role you must have

Bachelor's degree in Computer Science, Engineering, or a related field.
Experience with cloud-based AI services (e.g., AWS, Azure, GCP)
2+ years of experience developing AI/ML solutions, including at least 1 year of AI/ML testing experience.
Proficiency in Python and frameworks such as Tensorflow, PyTorch, or Scikit-learn.
Familiarity with version control tools (e.g., Git)
Experience working in agile development environments. 

Ideally, you’ll also have

Strong understanding of testing methodologies and frameworks for AI systems, including bias testing, performance testing, and security testing.
Familiarity with Large Language Models, Natural Language Processing (NLP), and AI frameworks.
Experience with testing tools such as DeepChecks, or similar AI-focused.
Experience in API integration and development.
This role involves interaction with clients operating nationally and globally where fluency in French and English is required. Bilingualism in both French and English is therefore a requirement of this role

What We Offer

At EY, our Total Rewards package supports our commitment to creating a leading people culture - built on high-performance teaming - where everyone can achieve their potential and contribute to building a better working world for our people, our clients and our communities. It's one of the many reasons we repeatedly win awards for being a great place to work.

We offer a competitive compensation package where you’ll be rewarded based on your performance and recognized for the value you bring to our business. In addition, our Total Rewards package allows you to decide which benefits are right for you and which ones help you create a solid foundation for your future. Our Total Rewards package includes a comprehensive medical, prescription drug and dental coverage, a defined contribution pension plan, a great vacation policy plus firm paid days that allow you to enjoy longer long weekends throughout the year, statutory holidays and paid personal days (based on province of residence), and a range of exciting programs and benefits designed to support your physical, financial and social well-being. Plus, we offer:

Support, coaching and feedback from some of the most engaging colleagues around
Opportunities to develop new skills and progress your career
The freedom and flexibility to handle your role in a way that’s right for you

Diversity and Inclusion at EY

Diversity and inclusiveness are at the heart of who we are and how we work. We’re committed to fostering an environment where differences are valued, policies and practices are equitable, and our people feel a sense of belonging. We embrace diversity and are committed to combating systemic racism, advancing gender equity and women in leadership, advocating for the 2SLGBTQIA+ community, promoting our neuroinclusion and accessibility initiatives, and are dedicated to amplifying the voices of Indigenous peoples (First Nations, Inuit, and Métis) nationally as we strive towards reconciliation. Our diverse experiences, abilities, backgrounds, and perspectives make our people unique and help guide us. Because when people feel free to be their authentic selves at work, they bring their best and are empowered to build a better working world.

EY | Building a better working world 

EY exists to build a better working world, helping to create long-term value for clients, people and society and build trust in the capital markets.

Enabled by data and technology, diverse EY teams in over 150 countries provide trust through assurance and help clients grow, transform and operate.

Working across assurance, consulting, law, strategy, tax and transactions, EY teams ask better questions to find new answers for the complex issues facing our world today."
