Job Title,Company,City,Work Mode,Description,Skills
Principal Machine Learning: Generative AI,Autodesk,"Toronto, ON",Hybrid,"About the job
Job Requisition ID #

25WD85983

French job description to follow!/La description de poste en français se trouve plus bas!

Position Overview

Autodesk is leading the transformation of the AEC industry, integrating AI technology into our products. We're enhancing our applications with cloud-native capabilities, including data at scale, edge computing, AI-based solutions, and advanced 3D modeling and graphics. This innovation is happening across our flagship products—AutoCAD, Revit, and Construction Cloud—and Forma, our new Industry Cloud.

As a Machine Learning Developer/Engineer on the AEC Solutions team, you will join a team of technologists to help build foundation models and generative AI tools for the AEC industry. You will work collaboratively to create and interpret design data that can enhance design and engineering workflows.

Report: You will report to the Machine Learning Manager in the Architecture, Engineering, and Construction (AEC) Solutions Team.

Location: We support hybrid work, and you work near our Boston, Massachusetts or Toronto, Canada offices.

Responsibilities

Architect and guide the implementation of scalable data pipelines and architectures
Work with large-scale multimodal datasets (text, 2D/3D geometry, and structured data), developing advanced preprocessing, augmentation, and content understanding techniques
Architect, develop, and optimize production-level ML solutions, focusing on scalability and reliability, while contributing to engineering best practices
Establish best practices for model experimentation, evaluation, and optimization
Contribute to technical execution by writing well-structured, high-performance code for production ML pipelines
Perform in-depth requirements analysis, collaborating with team members at different levels and documenting solutions
Set the technical direction by identifying key challenges and defining innovative solutions
Communicate technical findings effectively, influencing stakeholders through quantitative analysis, qualitative insights, and clear visual presentations
Mentor and guide junior engineers, fostering a culture of technical excellence and knowledge-sharing within the team

Minimum Qualifications

An MS in Machine Learning, Artificial Intelligence, Mathematics, Statistics, Computer Science, or a related field
10+ years of experience in machine learning engineering or a related field, with a proven track record of leadership and hands-on implementation
Expertise in deep learning architectures (e.g., Transformers, CNNs, GANs) and modern ML frameworks (e.g., PyTorch, Lightning, Ray)
Experience with LLMs and related technologies, including frameworks, embedding models, vector databases, and Retrieval-Augmented Generation (RAG) systems, in production settings
Deep understanding of data modeling, system architectures, and processing techniques, including 2D/3D geometric data representations
Experience with AWS cloud services and SageMaker Studio for scalable data processing and model development
Strong foundation in computer science fundamentals, distributed computing, and algorithmic efficiency
Proven ability to translate theoretical concepts into practical solutions and prototype implementations
Ability to work autonomously while effectively collaborating across teams, bridging the gap between research and practical implementation
Excellent technical writing and communication skills for documentation, presentations, and influencing cross-functional teams

Preferred Qualifications

Background in Architecture, Engineering, or Construction
Extensive experience in data preparation, hyper-parameter selection; acceleration techniques; and optimization methods
Proficiency in parallel and distributed computing techniques, with hands-on experience using platforms like Spark, Ray, or similar distributed systems for large-scale data processing and model training
Proven record in developing and deploying high-scale machine learning algorithms in production environments

Ideal Candidate

You are passionate about solving problems for AEC (Architecture, Engineering, and Construction) customers by applying machine learning techniques
You are comfortable driving progress in newly forming, ambiguous areas where learning and adaptability are key
You lead by doing, combining technical leadership with hands-on implementation
You easily collaborate with others and are comfortable with minimal direction
You constantly strive to learn new technologies and methodologies
You seek innovative solutions to difficult technical problems and iterate quickly on ideas
You are unafraid to experiment, share your ideas openly, and fail fast

Description Du Poste

Autodesk est à la tête de la transformation de l'industrie AEC, en intégrant la technologie de l'IA dans nos produits. Nous améliorons nos applications avec des capacités cloud-natives, y compris les données à l'échelle, l'edge computing, les solutions basées sur l'IA, ainsi que la modélisation et les graphiques 3D avancés. Cette innovation concerne nos produits phares - AutoCAD, Revit et Construction Cloud - ainsi que Forma, notre nouveau Cloud industriel.

En tant que développeur/ingénieur en apprentissage automatique au sein de l'équipe AEC Solutions, vous rejoindrez une équipe de technologues pour aider à construire des modèles de base et des outils d'IA générative pour l'industrie AEC. Vous travaillerez en collaboration pour créer et interpréter des données de conception qui peuvent améliorer les flux de travail de conception et d'ingénierie.

Rapport : Vous serez rattaché(e) au responsable de l'apprentissage automatique au sein de l'équipe des solutions pour l'architecture, l'ingénierie et la construction (AEC).

Lieu de travail : Nous soutenons le travail hybride, et vous travaillerez près de nos bureaux de Boston, Massachusetts ou Toronto, Canada.

Responsabilités

Architecte et guide dans la mise en œuvre de pipelines et d'architectures de données évolutives
Travailler avec des ensembles de données multimodales à grande échelle (texte, géométrie 2D/3D et données structurées), en développant des techniques avancées de prétraitement, d'augmentation et de compréhension du contenu
Architecturer, développer et optimiser des solutions de ML au niveau de la production, en se concentrant sur l'évolutivité et la fiabilité, tout en contribuant aux meilleures pratiques d'ingénierie
Établir les meilleures pratiques pour l'expérimentation, l'évaluation et l'optimisation des modèles
Contribuer à l'exécution technique en écrivant un code bien structuré et performant pour les pipelines de ML de production
Effectuer une analyse approfondie des besoins, collaborer avec les membres de l'équipe à différents niveaux et documenter les solutions
Vous définissez l'orientation technique en identifiant les principaux défis et en définissant des solutions innovantes
Vous communiquez efficacement les résultats techniques, en influençant les parties prenantes par des analyses quantitatives, des aperçus qualitatifs et des présentations visuelles claires
Encadrer et guider les ingénieurs débutants, en favorisant une culture de l'excellence technique et du partage des connaissances au sein de l'équipe

Qualifications Minimales

Une maîtrise en apprentissage automatique, en intelligence artificielle, en mathématiques, en statistiques, en informatique ou dans un domaine connexe
Plus de 10 ans d'expérience en ingénierie de l'apprentissage automatique ou dans un domaine connexe, avec une expérience éprouvée en matière de leadership et de mise en œuvre pratique
Expertise dans les architectures d'apprentissage profond (par exemple, Transformers, CNN, GAN) et les cadres modernes d'apprentissage automatique (par exemple, PyTorch, Lightning, Ray)
Expérience des LLM et des technologies connexes, y compris les frameworks, les modèles d'intégration, les bases de données vectorielles et les systèmes RAG (Retrieval-Augmented Generation), dans des contextes de production
Compréhension approfondie de la modélisation des données, des architectures de systèmes et des techniques de traitement, y compris les représentations géométriques des données en 2D/3D
Expérience des services en nuage AWS et de SageMaker Studio pour le traitement évolutif des données et le développement de modèles
Solides bases en informatique, en calcul distribué et en efficacité algorithmique
Capacité avérée à traduire des concepts théoriques en solutions pratiques et en prototypes de mise en œuvre
Capacité à travailler de manière autonome tout en collaborant efficacement avec d'autres équipes, en comblant le fossé entre la recherche et la mise en œuvre pratique
Excellentes aptitudes à la rédaction technique et à la communication pour la documentation, les présentations et l'influence sur les équipes interfonctionnelles

Qualifications Souhaitées

Expérience en architecture, ingénierie ou construction
Expérience approfondie de la préparation des données, de la sélection des hyperparamètres, des techniques d'accélération et des méthodes d'optimisation
Maîtrise des techniques de calcul parallèle et distribué, avec une expérience pratique de l'utilisation de plateformes telles que Spark, Ray ou des systèmes distribués similaires pour le traitement de données à grande échelle et l'apprentissage de modèles
Expérience confirmée dans le développement et le déploiement d'algorithmes d'apprentissage automatique à grande échelle dans des environnements de production

Candidat idéal

Vous êtes passionné par la résolution de problèmes pour les clients AEC (Architecture, Ingénierie et Construction) en appliquant des techniques d'apprentissage automatique
Vous êtes à l'aise pour faire avancer les choses dans des domaines nouveaux et ambigus où l'apprentissage et l'adaptabilité sont essentiels
Vous dirigez par l'action, en combinant leadership technique et mise en œuvre pratique
Vous collaborez facilement avec les autres et êtes à l'aise avec un minimum de directives
Vous vous efforcez constamment d'apprendre de nouvelles technologies et méthodologies
Vous cherchez des solutions innovantes à des problèmes techniques difficiles et vous développez rapidement vos idées
Vous n'avez pas peur d'expérimenter, de partager vos idées ouvertement et d'échouer rapidement

At Autodesk, we're building a diverse workplace and an inclusive culture to give more people the chance to imagine, design, and make a better world. Autodesk is proud to be an equal opportunity employer and considers all qualified applicants for employment without regard to race, color, religion, age, sex, sexual orientation, gender, gender identity, national origin, disability, veteran status or any other legally protected characteristic. We also consider for employment all qualified applicants regardless of criminal histories, consistent with applicable law.

Are you an existing contractor or consultant with Autodesk? Please search for open jobs and apply internally (not on this external site). If you have any questions or require support, contact Autodesk Careers.",[]
Machine Learning Engineer (AI Agents),Cresta,,,"About the job
Cresta is on a mission to turn every customer conversation into a competitive advantage by unlocking the true potential of the contact center. Our platform combines the best of AI and human intelligence to help contact centers discover customer insights and behavioral best practices, automate conversations and inefficient processes, and empower every team member to work smarter and faster. Born from the prestigious Stanford AI lab, Cresta's co-founder and chairman is Sebastian Thrun, the genius behind Google X, Waymo, Udacity, and more. Our leadership also includes CEO, Ping Wu, the co-founder of Google Contact Center AI and Vertex AI platform, and co-founder, Tim Shi, an early member of Open AI.

Join us on this thrilling journey to revolutionize the workforce with AI. The future of work is here, and it's at Cresta.

About The Role

At Cresta, the AI Agent team is on a mission to create state-of-the-art AI Agents that solve practical problems for our customers. We are focused on leveraging the latest technologies in Large Language Models (LLMs) and AI Agent systems, while ensuring that the solutions we develop are cost-effective, secure, and reliable. This role will involve hands-on work on cutting-edge projects, requiring innovative and passionate machine learning engineers who can bring research into practical, scalable applications.

As a Machine Learning Engineer, your goal will be to take AI Agents from the realm of research and bring them into practical, real-world use cases. This includes developing and deploying proprietary LLMs, scaling AI solutions, and addressing key challenges such as evaluation and reliability. While we’re focused on real-world application rather than pure research, you’ll be working with some of the most advanced technologies in the GenAI space.

This is a unique opportunity to shape the future of AI at Cresta by solving complex problems and bringing breakthrough AI advancements into production environments.

Responsibilities

Design, develop, and deploy Cresta’s AI Agent solutions and proprietary models.
Focus on practical AI challenges such as improving reasoning, planning capabilities, and evaluation in real-world scenarios.
Collaborate with cross-functional teams including front-end and back-end software engineers to integrate AI Agents into Cresta’s customer solutions.
Lead initiatives to scale AI systems for production environments, ensuring performance and reliability across use cases.
Contribute to solving cutting-edge problems in AI and help define the future roadmap for Cresta’s AI Agents.
Innovate and research ways to improve security, cost-efficiency, and reliability of AI systems.

Qualifications We Value

Bachelor’s or Master's Degree in Computer Science, Mathematics, or a related field
2+ years of hands-on industry experience with AI and machine learning, preferably with experience working with LLMs in large-scale production environments
Solid knowledge of machine learning concepts and methods, especially those related to NLP, Generative AI, and working with LLMs
Practical knowledge of modern machine learning frameworks and technologies (e.g., PyTorch, Tensorflow, Hugging Face, NumPy), as well as experience with distributed systems and cloud-based AI infrastructure
Strong problem-solving and strategic thinking abilities, with a proven ability to lead cross-functional teams and work collaboratively to deliver innovative AI solutions in production
A passion for driving AI adoption and pushing the boundaries of AI technology into real-world applications, with an ability to mentor junior engineers and influence strategic decisions across the organization

Perks & Benefits

We offer Cresta employees a variety of medical, dental, and vision plans, designed to fit you and your family’s needs
Paid parental leave to support you and your family
Monthly Health & Wellness allowance
Work from home office stipend to help you succeed in a remote environment
Lunch reimbursement for in-office employees 
PTO: 3 weeks in Canada 

Compensation for this position includes a base salary, equity, and a variety of benefits. Actual base salaries will be based on candidate-specific factors, including experience, skillset, and location, and local minimum pay requirements as applicable. We are actively hiring for this role in the US and Canada. Your recruiter can provide further details.

We have noticed a rise in recruiting impersonations across the industry, where scammers attempt to access candidates' personal and financial information through fake interviews and offers. All Cresta recruiting email communications will always come from the @cresta.ai domain. Any outreach claiming to be from Cresta via other sources should be ignored. If you are uncertain whether you have been contacted by an official Cresta employee, reach out to recruiting@cresta.ai",[]
Principal Solutions Engineer - Generative AI and Deep Learning,Synopsys Inc,,,"About the job
We Are: At Synopsys, we drive the innovations that shape the way we live and connect. Our technology is central to the Era of Pervasive Intelligence, from self-driving cars to learning machines. We lead in chip design, verification, and IP integration, empowering the creation of high-performance silicon chips and software content. Join us to transform the future through continuous technological innovation.

You Are: You are a visionary in the AI and machine learning space, with a passion for pushing the boundaries of technology. With an advanced degree in Science or Engineering and over 5 years of experience in diverse scientific and technological domains, you bring a unique blend of expertise. You have a proven track record in applying machine learning and AI methods to solve complex problems, particularly in corporate applications. Proficient in programming languages like Python, you have a solid grasp of data structures and algorithms, especially those found in generative AI applications. Your experience with Large Language Models (LLMs), Generative Pre-trained Transformers (GPT), and other generative AI techniques stands out.

You excel in both independent and collaborative environments, demonstrating strong problem-solving skills. Your excellent communication and presentation abilities allow you to convey complex technical concepts to a wide range of stakeholders. You are adept at data cleansing and modeling for deep learning in domains such as language, image, or graphs, and you have hands-on experience with cloud-based machine learning platforms like AWS, GCP, or Azure. Your deep understanding of AI trends and experience with frameworks like TensorFlow or PyTorch make you a valuable asset to any team.

What You’ll Be Doing:

Architecting Generative AI and Deep Learning applications tailored to internal corporate functions such as HR, Finance, Legal, and other departments.
Conducting experiments to evaluate model performance, identifying areas for improvement, and implementing optimizations to meet corporate function needs.
Collaborating with cross-functional teams to design and develop scalable AI solutions that align with internal business objectives.
Participating in generative AI platform teams to ensure alignment with application requirements, deployment models, and release timelines for corporate functions.
Communicating complex technical concepts and findings to both technical and non-technical stakeholders within the organization.
Leading solution architecture reviews, platform alignment, and deployment models for generative AI applications tailored to internal corporate functions.
Driving innovation in new generative AI approaches and staying up-to-date on the latest research in the field, specifically for enterprise applications.

The Impact You Will Have:

Enhancing the organization's capabilities in AI and machine learning, directly contributing to improved efficiency and effectiveness in internal corporate functions.
Improving the efficiency and performance of internal processes through advanced AI techniques.
Shaping the future of corporate methodologies with cutting-edge generative AI solutions.
Enabling the development of high-performance AI applications that streamline HR, Finance, Legal, and other internal processes.
Contributing to strategic goals with a direct impact on department results and overall organizational efficiency.
Leading initiatives that push the boundaries of technological innovation and execution excellence within the corporate environment.

What You’ll Need:

Advanced degree in Science or Engineering with 5+ years of experience in diverse scientific and technological domains.
2+ years of experience applying machine learning and AI methods to corporate or business problems.
Proficiency in Python and a solid background in data structures and algorithms.
Experience with LLMs, GPT models, and other generative AI techniques.
Strong problem-solving skills and the ability to work both independently and collaboratively.
Excellent communication and presentation skills.
Hands-on experience in data cleansing and modeling for deep learning models in at least one corporate domain (e.g., HR, Finance, Legal).
Experience with cloud-based machine learning platforms such as AWS, GCP, or Azure.

Specific Experiences:

Proven experience in developing AI-driven applications for internal corporate functions such as HR analytics, financial forecasting, legal document analysis, or customer service automation.
Familiarity with enterprise software ecosystems such as ERP (Enterprise Resource Planning) systems, CRM (Customer Relationship Management) systems, and other business management software.
Experience in integrating AI solutions with corporate IT infrastructure, including databases, data warehouses, and API management.
Knowledge of data privacy regulations and compliance issues, especially those relevant to corporate data (e.g., GDPR, CCPA).
Experience in designing and implementing AI models that can handle large-scale corporate data, including structured and unstructured data sources.
Practical experience with enterprise data integration tools and ETL (Extract, Transform, Load) processes.
Experience in deploying AI solutions in a corporate environment, ensuring scalability, reliability, and performance optimization.
Familiarity with project management methodologies and tools commonly used in corporate settings.

Who You Are:

A visionary leader in AI and machine learning.
A collaborative team player and an independent problem-solver.
An excellent communicator capable of translating complex technical concepts for diverse audiences.
A continuous learner who stays updated with the latest advancements in AI and machine learning.
A proactive innovator who drives technological progress within the corporate environment.

The Team You’ll Be A Part Of: You will be part of a dynamic team focused on leveraging AI and machine learning to revolutionize internal corporate functions. Our team collaborates across various departments, bringing together diverse expertise to develop innovative solutions that drive efficiency and effectiveness.

Rewards and Benefits: We offer a comprehensive range of health, wellness, and financial benefits to cater to your needs. Our total rewards include both monetary and non-monetary offerings. Your recruiter will provide more details about the salary range and benefits during the hiring process.",[]
