Job Title,Company,City,Work Mode,Description,Skills
"Senior Software Engineer, GenAI & ML Evaluation Frameworks - Grafana Ops, AI/ML (Remote, Canada)",Grafana Labs,Canada,Remote,"About the job
Grafana Labs is a remote-first, open-source powerhouse. There are more than 20M users of Grafana, the open source visualization tool, around the globe, monitoring everything from beehives to climate change in the Alps. The instantly recognizable dashboards have been spotted everywhere from a NASA launch and Minecraft HQ to Wimbledon and the Tour de France. Grafana Labs also helps more than 3,000 companies -- including Bloomberg, JPMorgan Chase, and eBay -- manage their observability strategies with the Grafana LGTM Stack, which can be run fully managed with Grafana Cloud or self-managed with the Grafana Enterprise Stack, both featuring scalable metrics (Grafana Mimir), logs (Grafana Loki), and traces (Grafana Tempo).

We’re scaling fast and staying true to what makes us different: an open-source legacy, a global collaborative culture, and a passion for meaningful work. Our team thrives in an innovation-driven environment where transparency, autonomy, and trust fuel everything we do.

You may not meet every requirement, and that’s okay. If this role excites you, we’d love you to raise your hand for what could be a truly career-defining opportunity.

This is a remote opportunity and we would be interested in applicants from Canada time zones only at this time.

Senior Engineer – GenAI & ML Evaluation Frameworks

At Grafana, we build observability tools that help users understand, respond to, and improve their systems – regardless of scale, complexity, or tech stack. The Grafana AI teams play a key role in this mission by helping users make sense of complex observability data through AI-driven features. These capabilities reduce toil, lower the barrier of domain expertise, and surface meaningful signals from noisy environments.

We are looking for an experienced engineer with expertise in evaluating Generative AI systems, particularly Large Language Models (LLMs), to help us build and evolve our internal evaluation frameworks, and/or integrate existing best-of-breed tools. This role involves designing and scaling automated evaluation pipelines, integrating them into CI/CD workflows, and defining metrics that reflect both product goals and model behavior. As the team matures, there’s a broad opportunity to expand or redefine this role based on impact and initiative.

The Kind Of Problems You’ll Be Tackling

Design and implement robust evaluation frameworks for GenAI and LLM-based systems, including golden test sets, regression tracking, LLM-as-judge methods, and structured output verification.
Develop tooling to enable automated, low-friction evaluation of model outputs, prompts, and agent behaviors.
Define and refine metrics for both structure and semantics, ensuring alignment with realistic use cases and operational constraints. 
Lead the development of dataset management processes and guide teams across Grafana in best practices for GenAI evaluation.


What We’re Looking For

Experience designing and implementing evaluation frameworks for AI/ML systems.
Familiarity with prompt engineering, structured output evaluation, and context-window management in LLM systems.
High autonomy to collaborate and translate team goals into clear, testable criteria supported by effective tooling.


General Qualities We’re Seeking

Experience working in environments with rapid iteration and experimental development.
A pragmatic mindset that values reproducibility, developer experience, and thoughtful trade-offs when scaling GenAI systems.
A passion for minimizing human toil and building AI systems that actively support engineers.


In Canada, the Base compensation range for this role is CAD 153,729 - CAD 184,475. Actual compensation may vary based on level, experience, and skillset as assessed in the interview process. Benefits include equity, bonus (if applicable) and other benefits listed here.

Compensation ranges are country-specific. If you are applying for this role from a different location than listed above, your recruiter will discuss your specific market’s defined pay range & benefits at the beginning of the process.
Grafana Labs may utilize AI tools in its recruitment process to assist in matching information provided in CVs to job postings. The recruitment team will continue to review inbound CVs manually to identify alignment with current openings.
Compensation ranges are country specific. If you are applying for this role from a different location than listed above, your recruiter will discuss your specific market’s defined pay range & benefits at the beginning of the process.


Why You’ll Thrive At Grafana Labs

Scaling Organization – Tackle meaningful work in a high-growth, ever-evolving environment.
Remote-First, Global Culture – Work from anywhere with collaboration at the heart of everything we do.
Transparent Communication – Expect open decision-making and regular company-wide updates.
Innovation-Driven – Autonomy and support to ship great work and try new things.
Open Source Roots – Built on community-driven values that shape how we work.
Empowered Teams – High trust, low ego culture that values outcomes over optics.
Career Growth Pathways – Defined opportunities to grow and develop your career.
Approachable Leadership – Transparent execs who are involved, visible, and human.
Passionate People – Join a team of smart, supportive folks who care deeply about what they do.
In-Person onboarding - We want you to thrive from day 1 with your fellow new ‘Grafanistas’ to learn all about what we do and how we do it. 
Balance is Key - We operate a global annual leave policy of 30 days per annum. 3 days of your annual leave entitlement are reserved for Grafana Shutdown Days to allow the team to really disconnect. *We will comply with local legislation where applicable.


Equal Opportunity Employer: We will recruit, train, compensate and promote regardless of race, religion, color, national origin, gender, disability, age, veteran status, and all the other fascinating characteristics that make us different and unique. We believe that equality and diversity builds a strong organization and we’re working hard to make sure that’s the foundation of our organization as we grow.

For information about how your personal data is used once you’ve applied to a job, check out our privacy policy.",[]
AI Platform Engineering Specialist (Hybrid),Morgan Stanley,,,"About the job
Our mission is to develop a firmwide Artificial Intelligence (AI) Development Platform that aligns with the firm’s Technology principles and drives efficiency and consistency, controls, security and strong governance and promotes innovation, enabling teams to build applications that leverage AI capabilities and accelerate the adoption of AI across our businesses.

This role is for a platform engineering specialist who will help build a firmwide AI Development Platform and drive adoption of AI capabilities throughout the enterprise. We have multiple focus areas across the platform and are looking for energetic, multi-disciplinary candidates who are eager to contribute to providing scalable, secure, enterprise-wide solutions for the firm.

The ideal candidate will have strong hands-on experience building software platforms on any combination of the following platforms - Kubernetes, Cloud (AWS, Azure, and/or Google), API based development, REST framework, data engineering, and large-scale API Gateway environments etc.

Knowledge of AIML and hands-on experience implementing solutions using Generative AI are also preferable. The candidate will have great communication skills, a team-based mentality and a strong passion for using AI to increase productivity as well as help generate new ideas for product & technical improvements.

In the Technology division, we leverage innovation to build the connections and capabilities that power our Firm, enabling our clients and colleagues to redefine markets and shape the future of our communities.

Since 1935, Morgan Stanley is known as a global leader in financial services, always evolving and innovating to better serve our clients and our communities in more than 40 countries around the world.

Interested in joining a team that’s eager to create, innovate and make an impact on the world? Read on…

What You'll Do In The Role

Below is a sample of potential responsibilities depending on product / focus area

Develop tooling and self-service capabilities for deploying AI solutions for the firm leveraging Kubernetes/OpenShift, Python, authentication solutions, APIs, REST framework, etc.
Develop Terraform modules and Cloud architecture to enable secure AI cloud service deployment and consumption at scale.
Have a platform mindset and build common, reusable solutions to scale Generative AI use cases using pre-trained models as well as fine-tuned models. 
Leverage Kubernetes/OpenShift to develop modern containerized workloads.
Integrate with capabilities such as large-scale vector stores for embeddings. 
Author best practices on the Generative AI ecosystem, when to use which tools, available models such as GPT, Llama, Hugging Face etc. and libraries such as Langchain. 
Analyze, investigate, and implement GenAI solutions focusing on Agentic Orchestration and Agent Builder frameworks.
Author and publish architecture decision records to capture major design decisions and product selection for building Generative AI solutions. Inclusive of app authentication, service communication, state externalization, container layering strategy and immutability.
Ensure AI platform are reliable, scalable, and operational; (e.g. blueprints for upgrade/release strategies (E.g. Blue/Green); logging/monitoring/metrics; automation of system management tasks)
Participate in all team’s Agile/ Scrum ceremonies.
Participate in team’s oncall rotation in build/run team model

What You'll Bring To The Role

Bachelor’s or Master’s degree in Computer Science or related field, or equivalent job experience 
5 years of experience in software engineering, design and development
Strong hands-on Application Development background in at least one prominent programming language, preferably Python Flask or FAST Api.
Broad understanding of data engineering (SQL, NoSQL, Big Data, Kafka, Redis), data governance, data privacy and security.
Experience in development, management, and deployment of Kubernetes workloads, preferably on OpenShift.
Experience with designing, developing, and managing RESTful services for large-scale enterprise solutions.
Experience deploying applications on Azure, AWS, and/or GCP using IaC (Terraform)
Hands-on experience with multiprocessing, multithreading, asynchronous I/O, performance profiling in at least one prominent programming language, preferably python.
Ability to articulate technical concepts effectively to diverse audiences.
Excellent communication skills.
Demonstrated ability to work effectively and collaboratively in a global organization, across time zones, and across organizations
Demonstrated experience in DevOps, understanding of CI/CD (Jenkins) and GitOps.
Knowledge of DevOps and Agile practices.

Nice to have

Practitioner of unit testing, performance testing and BDD/acceptance testing.
Understanding of OAuth 2.0 protocol for secure authorization.
Proficiency with Open Telemetry tools including Grafana, Loki, Prometheus, and Cortex.
Good knowledge of Microservice based architecture, industry standards, for both public and private cloud.
Good understanding of modern Application configuration techniques.
Hands on experience with Cloud Application Deployment patterns like Blue/Green.
Good understanding of State sharing between scalable cloud components (Kafka, dynamic distributed caching).
Good knowledge of various DB engines (SQL, Redis, Kafka, etc) for cloud app storage.
Experience building AI applications, preferably Generative AI and LLM based apps. 
Deep understanding of AI agents, Agentic Orchestration, Multi-Agent Workflow Automation, along with hands-on experience in Agent Builder frameworks such Lang Chain and Lang Graph.
Experience working with Generative AI development, embeddings, fine tuning of Generative AI models. 
Understanding of ModelOps/ ML Ops/ LLM Op.
Understanding of SRE techniques.

At Morgan Stanley Montreal, we support the Firm’s global businesses and infrastructure with cutting edge technology and innovation. The multi-faceted and highly technical Montreal team plays a critical role in building and maintaining our leading technology platform, including electronic trading, algorithm trading, cloud engineering, infrastructure, cybersecurity and AI/ML. Morgan Stanley has been rooted in the Montreal community since 2008 and is considered a leading employer among the area’s highly skilled technology talent. There’s ample opportunity to move across the businesses for those who show passion and grit in their work.

Morgan Stanley is an equal opportunities employer. We work to provide a supportive and inclusive environment where all individuals can maximize their full potential.

All our positions are located in Montreal, Quebec. We offer a hybrid work environment, combining remote work and attendance in the office.

Knowledge of French and English is required.

Build a career with impact. Visit morganstanley.com for more inform

ation

What You Can Expect From Morgan Stanley

We are committed to maintaining the first-class service and high standard of excellence that have defined Morgan Stanley for over 89 years. Our values - putting clients first, doing the right thing, leading with exceptional ideas, committing to diversity and inclusion, and giving back - aren’t just beliefs, they guide the decisions we make every day to do what's best for our clients, communities and more than 80,000 employees in 1,200 offices across 42 countries. At Morgan Stanley, you’ll find an opportunity to work alongside the best and the brightest, in an environment where you are supported and empowered. Our teams are relentless collaborators and creative thinkers, fueled by their diverse backgrounds and experiences. We are proud to support our employees and their families at every point along their work-life journey, offering some of the most attractive and comprehensive employee benefits and perks in the industry. There’s also ample opportunity to move about the business for those who show passion and grit in their work.

To learn more about our offices across the globe, please copy and paste https://www.morganstanley.com/about-us/global-offices into your browser.

Morgan Stanley is an equal opportunities employer. We work to provide a supportive and inclusive environment where all individuals can maximize their full potential.",[]
Generative AI Engineer,micro1,Canada,Remote,"About the job
Job Title: Generative AI Engineer

Job Type: Full-time

Location: Remote

About Us:
Our mission at micro1 is to match the most talented people in the world with their dream jobs. If you are looking to be at the forefront of AI innovation and work with some of the fastest-growing companies in Silicon Valley, we invite you to apply for a role. By joining the micro1 community, your resume will become visible to top industry leaders, unlocking access to the best career opportunities on the market.

Job Summary :
Join our customer's team as a Generative AI Engineer, where you'll pioneer cutting-edge generative AI solutions and enable transformative business capabilities. You will leverage the latest advancements in GenAI, Retrieval-Augmented Generation (RAG), and industry-leading frameworks to deliver scalable, innovative projects. This is a unique opportunity to work remotely in a collaborative environment that prizes technical expertise and exceptional communication skills.

Key Responsibilities :
Design, develop, and deploy multi-agent AI systems using frameworks like LangChain, LangGraph, and AutoGen.
Build and orchestrate AI agents capable of tool integration, decision-making, and collaboration.
Lead the transition of GenAI prototypes to production-grade solutions, ensuring scalability and reliability.
Integrate external tools and APIs (e.g., GitHub, UI components, internal systems) into agent workflows.
Implement and support RAG pipelines and prompt engineering strategies for domain-specific applications.
Collaborate with cross-functional teams to deliver impactful AI solutions in real-world environments.
Leverage Databricks for data processing, model training, and MLOps workflows.
Contribute to the evolution of our agentic AI strategy, including experimentation with HPC and advanced orchestration.

Required Skills and Qualifications:
5+ years of experience in AI/ML development, with a strong foundation in Python.
Hands-on experience with LangChain/LangGraph or AutoGen, or similar agentic frameworks.
Proven track record of delivering GenAI solutions from MVP to production.
Experience with tool integration into AI agents (e.g., GitHub APIs, UI workflows).
Solid understanding of prompt engineering and retrieval-augmented generation (RAG).
Familiarity with Databricks and MLflow for model tracking, deployment, and monitoring.
Strong problem-solving skills and a passion for exploring the future of agentic and generative AI.

Preferred Qualifications:
Exposure to pharma, life sciences, or regulated industries.
Contributions to open-source GenAI or agentic AI projects.",[]
AI Engineer,Altis Recruitment,"Vancouver, BC",Hybrid,"About the job
We’re supporting a fast-paced team seeking a hands-on AI Engineer to design and deploy scalable Generative AI solutions. This role is ideal for someone with deep experience in LLM-powered applications, agent frameworks, and Google Cloud Platform (GCP) services such as Vertex AI and BigQuery. The work spans applied AI engineering, solution architecture, and cross-functional collaboration to bring business use cases to life.

Key Responsibilities
Design, build, and deploy LLM-powered solutions using frameworks like LangGraph, Agent SDKs (Google, OpenAI, Microsoft), and PydanticAI.
Architect and implement multi-agent workflows that incorporate search, automation, retrieval, and summarization.
Build scalable cloud backends using Vertex AI, Cloud Run Functions, BigQuery, and other GCP services.
Collaborate with cross-functional teams (e.g., architects, consultants, data engineers) to translate business challenges into AI solutions.
Prototype rapidly, evaluate LLMs (open-source and proprietary), and deploy PoCs with measurable outcomes.
Monitor agent reliability, improve response quality, and mitigate hallucinations.
Write clean, testable, and well-documented code.
Contribute to internal accelerators and help shape the team's agentic development toolkit.
Stay current on trends in LLMs, orchestrators, vector DBs, and GCP innovations.

Qualifications
4–7 years of experience in software engineering, ML engineering, or AI product development.
Strong Python development skills and experience building modular, scalable systems.
Demonstrated experience with GenAI systems, including RAG pipelines, custom agents, or conversational assistants.
Hands-on with GCP, especially Vertex AI, BigQuery, Cloud Run Functions, IAM, and Cloud Storage.
Proficient with agent frameworks such as Agent SDK, LangGraph, CrewAI, LangChain, LlamaIndex, or PydanticAI.
Solid understanding of LLM system components: prompt engineering, tool use, RAG, tuning.
Experience working in ambiguous environments and iterating quickly (“fail fast” mindset).
Strong communicator—able to explain technical trade-offs to non-technical stakeholders and contribute to client demos or working sessions.
Skilled in requirements gathering and translating business needs into data or AI workflows.

Preferred Qualifications
Data Science & MLOps:
Experience comparing GenAI with traditional ML approaches (classification, clustering, summarization).
Background in data wrangling, especially for RAG pipelines or predictive models.
Experience with DBT and designing analytics-ready datasets (e.g., star schema).
Familiar with ML orchestration tools (Vertex Pipelines, Airflow, Prefect).
Knowledge of model monitoring (drift detection, feedback loops) and version control best practices.
Consulting & Delivery:
Familiar with Agile delivery across phases: discovery, PoC, iteration, deployment, sustainment.
Able to flag implementation risks, estimate effort, and navigate data dependencies.",[]
