Job Title,Company,City,Work Mode,Description,Skills
Generative AI Engineer,Alexa Translations,"Montreal, QC",Hybrid,"About the job
About Alexa Translations
Alexa Translations provides translation services in the legal, financial, and securities sectors by leveraging proprietary A.I. technology and a team of highly specialized linguistic experts. Unmatched in speed and quality, our machine translation engine is best-in-class and specifically trained for the French-Canadian market. If that wasn’t enough, our technology is backed by two decades of award-winning client service.

About the Role
We are looking for a Generative AI Engineer to develop our next-generation intelligent translation and translation-related service engine, using Generative AI (GenAI) and Large Language Model (LLM) technologies. You will report to the team lead on GenAI, develop and implement state-of-the-art algorithms by fast prototyping, and collaborate with the software team to deploy models. We expect our Generative AI Engineer to stay current with the technological cutting edge and build applications of LLM and GenAI to machine translation with best industry practices, as well as having solid background and hands-on experience with deep learning, machine learning, natural language processing, and big data.

Responsibilities
Research and implement state-of-the-art LLM techniques including continued pre-training, instruction fine-tuning, preference alignment, and LLM deployment while also focusing on prompt engineering and GenAI more broadly
Work closely with machine learning engineers and data scientists to design, build, and test models
Contribute to technological innovations by staying current to the cutting-edge achievements of GenAI and LLM from industry and academia
Develop efficient and scalable algorithms for training and inference of generative models, leveraging deep learning frameworks such as TensorFlow or PyTorch and optimizing performance on diverse hardware platforms
Train and evaluate generative models using appropriate metrics and benchmarks, fine-tuning model parameters, architectures, and hyperparameters to optimize performance, stability, and generalization
Work closely with software and DevOps engineers to deploy GenAI models
Document code, algorithms, and experimental results, following best practices for reproducibility, version control, and software engineering, and contribute to internal knowledge sharing and continuous improvement initiatives.
 Requirements
Bachelor's or Master's degree in Computer Science, Artificial Intelligence, Machine Learning, or related field
1+ years of industry experience developing GenAI and LLM applications is preferred
2+ years of professional experience as a software engineer is required.
Proficiency in Python programming and software development practices, with experience in building and maintaining scalable, production-grade software systems
Working knowledge and project-based record of all of the following: prompt tuning, RAG, ICL
Working knowledge and project-based record of at least one of the following is a plus: continued pre-training, instruction fine-tuning, Agent
Strong problem-solving skills, attention to detail, and the ability to work independently and collaboratively in a fast-paced environment
Hands-on experience with Huggingface APIs or Amazon Bedrock
Expert skills of Python, including PyTorch, TensorFlow, Pandas, etc
Experience with cloud platforms like AWS, GCP, or Azure
Self-driven, self-motivated with excellent time management skills
Excellent communication skills, with the ability to convey complex technical concepts clearly and effectively to both technical and non-technical stakeholders
Familiarity with GPU programming and optimization techniques for accelerating deep learning computations
Ability to adapt to shifting priorities without compromising deadlines and momentum
Prior experience in generative AI research, projects, or internships, with contributions to open-source projects or publications in relevant conferences or journals",[]
Generative AI Engineer,Alexa Translations,"Toronto, ON",Hybrid,"About the job
About Alexa Translations
Alexa Translations provides translation services in the legal, financial, and securities sectors by leveraging proprietary A.I. technology and a team of highly specialized linguistic experts. Unmatched in speed and quality, our machine translation engine is best-in-class and specifically trained for the French-Canadian market. If that wasn’t enough, our technology is backed by two decades of award-winning client service.

About the Role
We are looking for a Generative AI Engineer to develop our next-generation intelligent translation and translation-related service engine, using Generative AI (GenAI) and Large Language Model (LLM) technologies. You will report to the team lead on GenAI, develop and implement state-of-the-art algorithms by fast prototyping, and collaborate with the software team to deploy models. We expect our Generative AI Engineer to stay current with the technological cutting edge and build applications of LLM and GenAI to machine translation with best industry practices, as well as having solid background and hands-on experience with deep learning, machine learning, natural language processing, and big data.

Responsibilities
Research and implement state-of-the-art LLM techniques including continued pre-training, instruction fine-tuning, preference alignment, and LLM deployment while also focusing on prompt engineering and GenAI more broadly
Work closely with machine learning engineers and data scientists to design, build, and test models
Contribute to technological innovations by staying current to the cutting-edge achievements of GenAI and LLM from industry and academia
Develop efficient and scalable algorithms for training and inference of generative models, leveraging deep learning frameworks such as TensorFlow or PyTorch and optimizing performance on diverse hardware platforms
Train and evaluate generative models using appropriate metrics and benchmarks, fine-tuning model parameters, architectures, and hyperparameters to optimize performance, stability, and generalization
Work closely with software and DevOps engineers to deploy GenAI models
Document code, algorithms, and experimental results, following best practices for reproducibility, version control, and software engineering, and contribute to internal knowledge sharing and continuous improvement initiatives.
 Requirements
Bachelor's or Master's degree in Computer Science, Artificial Intelligence, Machine Learning, or related field
1+ years of industry experience developing GenAI and LLM applications is preferred
2+ years of professional experience as a software engineer is required.
Proficiency in Python programming and software development practices, with experience in building and maintaining scalable, production-grade software systems
Working knowledge and project-based record of all of the following: prompt tuning, RAG, ICL
Working knowledge and project-based record of at least one of the following is a plus: continued pre-training, instruction fine-tuning, Agent
Strong problem-solving skills, attention to detail, and the ability to work independently and collaboratively in a fast-paced environment
Hands-on experience with Huggingface APIs or Amazon Bedrock
Expert skills of Python, including PyTorch, TensorFlow, Pandas, etc
Experience with cloud platforms like AWS, GCP, or Azure
Self-driven, self-motivated with excellent time management skills
Excellent communication skills, with the ability to convey complex technical concepts clearly and effectively to both technical and non-technical stakeholders
Familiarity with GPU programming and optimization techniques for accelerating deep learning computations
Ability to adapt to shifting priorities without compromising deadlines and momentum
Prior experience in generative AI research, projects, or internships, with contributions to open-source projects or publications in relevant conferences or journals",[]
"Fellow AI Architect, Generative AI",UKG,"Montreal, QC",Hybrid,"About the job
Company Overview

With 80,000 customers across 150 countries, UKG is the largest U.S.-based private software company in the world. And we’re only getting started. Ready to bring your bold ideas and collaborative mindset to an organization that still has so much more to build and achieve? Read on.

At UKG, you get more than just a job. You get to work with purpose. Our team of U Krewers are on a mission to inspire every organization to become a great place to work through our award-winning HR technology built for all.

Here, we know that you’re more than your work. That’s why our benefits help you thrive personally and professionally, from wellness programs and tuition reimbursement to U Choose — a customizable expense reimbursement program that can be used for more than 200+ needs that best suit you and your family, from student loan repayment, to childcare, to pet insurance. Our inclusive culture, active and engaged employee resource groups, and caring leaders value every voice and support you in doing the best work of your career. If you’re passionate about our purpose — people —then we can’t wait to support whatever gives you purpose. We’re united by purpose, inspired by you.

About The Role

We are searching for an exceptionally skilled and visionary Fellow AI Architect with deep expertise in building, deploying, and scaling generative AI applications. As a key individual contributor at the Technical Fellow level, you will drive the architecture, strategy, and development of groundbreaking AI technologies that support our long-term mission.

The Fellow AI Architect will lead the technical vision, strategy, and architectural direction for our GenAI initiatives. As a recognized thought leader, you will help guide the company to stay at the forefront of AI innovation, continuously integrating the latest advancements in generative AI into our products and processes. This role demands a blend of technical depth, visionary thinking, and the ability to influence and elevate company-wide AI practices. You will play a pivotal role in shaping a transformative journey, empowering our organization to harness GenAI in profound ways across all products.

Responsibilities

 Architectural Vision & Strategy: Define and drive the generative AI architecture strategy, ensuring UKG remains at the leading edge of AI innovation. Develop and communicate a cohesive architectural vision that aligns with business goals, enabling the seamless integration of GenAI capabilities across our product suite.
 Technical Leadership: Serve as the primary technical visionary for generative AI, providing hands-on guidance in advanced methods (e.g., transformer models, diffusion models, GANs) and setting technical standards that ensure scalability, security, and efficiency.
 Cross-Functional Collaboration: Work closely with executive leadership, product management, data science, and engineering teams to establish and prioritize GenAI initiatives. Collaborate with cross-functional teams to ensure alignment on requirements and objectives, driving the infusion of AI capabilities across products.
 Innovation & Research: Conduct hands-on, advanced research in generative AI, staying current with emerging technologies, industry trends, and best practices. Lead the exploration and implementation of state-of-the-art GenAI techniques to enhance product value and drive a competitive edge.
 Mentorship & Culture Building: Mentor and influence senior engineering leaders, fostering a culture of AI excellence, thought leadership, and continuous innovation. Champion best practices in AI/ML development, CI/CD processes, and quality assurance to ensure high standards across the organization.
 Community Engagement: Act as an ambassador for generative AI internally and externally, representing UKG in the AI community through publications, speaking engagements, and industry forums.
 Scalable Solutions: Oversee the deployment of large-scale AI models, ensuring they are optimized for performance, cost, and resource efficiency in production environments. Establish guidelines for high-quality, production-ready AI/ML systems that can scale with business needs.
 Governance & Standards: Define and enforce development methodologies, CI/CD standards, and architectural guidelines for AI solutions. Maintain documentation of architectural decisions and technical roadmaps, ensuring a sustainable foundation for future AI-driven capabilities.

Qualifications

 Educational Background: PhD in Computer Science, AI, Machine Learning, or a related field, or equivalent industry experience.
 Experience: 12+ years in software development and AI, with at least 5 years of hands-on experience in generative AI, NLP, or related fields. Proven expertise in architecting and deploying large-scale AI/ML systems in production environments.
 Technical Proficiency: Expert-level skills in programming languages (e.g., Python, Java) and AI frameworks (e.g., TensorFlow, PyTorch). Strong understanding of cloud platforms (AWS, Google Cloud, Azure) and MLOps practices for large-scale model training and deployment.
 AI Methodologies: In-depth knowledge of generative AI methodologies, including transformer models, diffusion models, GANs, large language models, and multi-modal architectures. Familiarity with NLP and machine learning algorithms, such as linear and logistic regression, decision trees, and clustering methods.
 Industry Influence: Recognized thought leader in AI, with a record of publications in top-tier AI conferences/journals (e.g., NeurIPS, ICML, CVPR) and a strong network within the AI research community.
 Problem-Solving & Strategy: Exceptional problem-solving skills and a proven ability to influence and implement long-term AI-driven strategic initiatives.

Preferred Qualifications

 Compliance & Responsible AI: Experience working in high-compliance environments or with privacy-preserving AI techniques. Strong familiarity with trends in responsible AI, model interpretability, and ethical AI practices.
 Optimization Expertise: Proven record of optimizing AI models for cost-efficiency at scale through model compression, distillation, and efficient deployment strategies.
 Cloud & DevOps Knowledge: Strong experience with cloud-native architectures, containerization (e.g., Kubernetes), and CI/CD pipeline automation (e.g., Terraform, GitHub Actions).

Where we’re going 

UKG is on the cusp of something truly special. Worldwide, we already hold the #1 market share position for workforce management and the #2 position for human capital management. Tens of millions of frontline workers start and end their days with our software, with billions of shifts managed annually through UKG solutions today. Yet it’s our AI-powered product portfolio designed to support customers of all sizes, industries, and geographies that will propel us into an even brighter tomorrow!

Equal Opportunity Employer 

Ultimate Kronos Group is proud to be an equal opportunity employer and is committed to maintaining a diverse and inclusive work environment. All qualified applicants will receive considerations for employment without regard to race, color, religion, sex, age, disability, marital status, familial status, sexual orientation, pregnancy, genetic information, gender identity, gender expression, national origin, ancestry, citizenship status, veteran status, and any other legally protected status under federal, state, or local anti-discrimination laws. 

View The EEO Know Your Rights poster 

UKG participates in E-Verify. View the E-Verify posters here . 

Disability Accommodation

For individuals with disabilities that need additional assistance at any point in the application and interview process, please email UKGCareers@ukg.com . 

The pay range for this position is $202,300 to $290,800, however, base pay offered may vary depending on skills, experience, job-related knowledge and location. This position is also eligible for a short-term incentive and a long-term incentive as part of total compensation. Information about UKG’s comprehensive benefits can be reviewed on our careers site at https://www.ukg.com/careers",[]
Senior Gen AI Software Engineer,Liftoff Mobile,"Vancouver, BC",Remote,"About the job
Liftoff is a leading AI-powered performance marketing platform for the mobile app economy. Our end-to-end technology stack helps app marketers acquire and retain high-value users, while enabling publishers to maximize revenue across programmatic and direct demand.

Liftoff’s solutions, including Accelerate, Direct, Monetize, Intelligence, and Vungle Exchange, support over 6,600 mobile businesses across 74 countries in sectors such as gaming, social, finance, ecommerce, and entertainment. Founded in 2012 and headquartered in Redwood City, CA, Liftoff has a diverse, global presence.

Join Liftoff as a Gen AI Software Engineer and shape the future of ad tech. As a key member of our Gen AI team, you'll architect and develop AI-powered solutions that transform how our business operates. Your focus will be building intelligent agents that enhance our sales, customer success, finance, and other core functions, while also leveraging cutting-edge vision and diffusion models to revolutionize creative production.

In this role, you'll have an immediate impact on our AI strategy and product development. We foster a collaborative environment where you'll work closely with key decision makers to bring innovative solutions to life. You'll have the freedom to experiment, mentor others, and grow into a thought leader who defines not just Liftoff's AI future, but influences the broader ad tech industry.

This role is ideal for an engineer who thrives in ambiguity, has a passion for experimentation, and wants to push the boundaries of what's possible with LLMs. You'll have the opportunity to tackle complex challenges, validate new approaches, and drive meaningful improvements across our organization.

What You'll Do

Pioneer next-generation enterprise applications by architecting scalable, interoperable AI agents that reimagine and automate workflows across sales, customer success, creative, finance and other core functions
Rapidly prototype and validate Gen AI solutions through quick proof-of-concepts, then leverage learnings and feedback to ship production-ready solutions at speed
Partner with decision makers and subject matter experts across the organization to deeply understand existing workflows and seamlessly integrate AI agents into daily operations
Design robust systems that effectively manage uncertain AI-generated results, create reliable guardrails, and develop flexible products capable of handling the inherent variability in generative AI outputs. 
Design and implement comprehensive evaluation frameworks, monitoring systems, and dashboards assess model performance
Treat prompt engineering as both an art and a science via iteration, analysis, and collaboration with cross-functional teams to translate human workflows into LLM instructions
Implement and refine advanced Retrieval-Augmented Generation (RAG) systems, optimizing embedding models, text chunking, and vector storage. 
Drive innovation by researching LLM and Generative AI advancements, sharing insights, and proposing new product initiatives that leverage emerging AI capabilities. 
Mentor and champion best practices across the engineering team, fostering an environment of open feedback and shared learning that pushes our team forward. 

Who You Are

Minimum Bachelors Degree and 5yrs of relevant experience. 
Seasoned software engineer with proven experience building products 0-1 and a strong proficiency in Python. 
Push engineering boundaries by challenging traditional approaches, and bringing proven expertise to adapt best practices for AI-first development. 
Have experience building autonomous Gen AI agents in sales, customer support, or other key functions, demonstrating proficiency in multi-agent systems and complex task decomposition. 
Have experience in developing and implementing evaluation frameworks for Gen AI products, including automated testing and human-in-the-loop feedback systems. 
An experienced prompt engineer who has spent significant time optimizing Gen AI products through systematic experimentation and iteration. 
Demonstrated ability to navigate ambiguity, make quick, informed decisions, and course-correct rapidly as new information emerges. 
Gen AI enthusiast who deeply understands LLMs' capabilities and advocates for letting models shine rather than over-constraining them with deterministic prompting. 
Natural collaborator who communicates complex technical concepts clearly and works effectively with diverse stakeholders. 
Lifelong learner with strongly-held but flexible beliefs, who thrives on giving and receiving constructive feedback. 

Location:

This role is eligible for full-time remote work in one of our entities: Canada

We are a remote-first company with US hubs in Redwood City, Los Angeles, and New York City.

Travel Expectations:

We offer several opportunities for in-person team gatherings, including but not limited to project meetings, regional meetups, and company-wide events. We expect our employees to attend these gatherings at least once per quarter. These gatherings provide essential opportunities for collaboration, communication, and team building.

Compensation:

Liftoff offers all employees a full compensation package that includes equity and health/vision/dental benefits associated with your country of residence. Base compensation will vary based on the candidate's location and experience.

The following are our base salary ranges for multiple levels:

Canada [all]: CAD 120,000 - 180,000 plus bonus

We use Covey as part of our hiring and / or promotional process for jobs in NYC and certain features may qualify it as an AEDT. As part of the evaluation process we provide Covey with job requirements and candidate submitted applications. We began using Covey Scout for Inbound on January 22, 2024.

Please see the independent bias audit report covering our use of Covey here.

Liftoff is committed to providing and maintaining a work environment where all employees and candidates are treated with dignity and respect and that is free of bias, prejudice, and harassment. Liftoff is further committed to providing an equal employment opportunity for all employees and candidates for employment free from discrimination and harassment on the basis of sex, gender (including sexual harassment, gender harassment, and harassment due to pregnancy, childbirth, breastfeeding, and related conditions), sexual orientation, gender identity, gender expression, gender nonconformity, race, creed, religion, color, national origin, ancestry (including association, affiliation, or participation with persons or activities related to national origin, English-proficiency or accent, or immigration status), physical or mental disability, medical condition(s), genetic information of an individual or family member of the individual, marital or domestic partner status, age, veteran or military status, family care status, requesting or taking pregnancy, parental or disability leave, requesting an accommodation, or any other characteristic protected by federal, state, or local law, regulation, or ordinance. All such discrimination and harassment is unlawful and will not be tolerated. Liftoff maintains a continued commitment to equal employment opportunity and expects the full cooperation of all personnel.

Liftoff's Compensation Strategy

Liftoff's compensation strategy includes competitive market rate along with equity and benefits and perks that will give our employees what they need to do their best work. In order to ensure teams are compensated fairly for the work performed, we map out specific levels and take into consideration the cost of labor within each location. Liftoff provides employees a total compensation package of competitive market salaries, equity, health and wellness stipends, medical benefits associated with your country of residence. The base compensation will vary based on location, experience as well as level.

Agency and Third Party Recruiter Notice:

Liftoff does not accept unsolicited resumes from individual recruiters or third-party recruiting agencies in response to job postings. No fee will be paid to third parties who submit unsolicited candidates directly to our hiring managers or Recruiting Team. All candidates must be submitted via our Applicant Tracking System by approved Liftoff vendors who have been expressly requested to make a submission by our Recruiting Team for a specific job opening. No placement fees will be paid to any firm unless such a request has been made by the Liftoff Recruiting Team and such a candidate was submitted to the Liftoff Recruiting Team via our Applicant Tracking System.",[]
