Job Title,Company,City,Work Mode,Description,Skills
"Senior Applied AI Architect, Applied AI & Data Architecture (AIDA)",Amazon Web Services (AWS),,,"About the job
Description

AWS Global Sales drives adoption of the AWS cloud worldwide, enabling customers of all sizes to innovate and expand in the cloud. Our team empowers every customer to grow by providing tailored service, unmatched technology, and unwavering support. We dive deep to understand each customer's unique challenges, then craft innovative solutions that accelerate their success. This customer-first approach is how we built the world's most adopted cloud. Join us and help us grow.

The Role

The Amazon Web Services (AWS) Senior Applied AI Architect partners with customers to design and build some of the most scalable, flexible and resilient cloud architectures and solutions. AWS Applied AI Architects collaborate with AWS Sales and other AWS teams to help address customer business challenges and accelerate the adoption of AWS services.

As a trusted customer advocate, Applied AI Architects help organizations understand best practices around advanced cloud-based solutions, and provide advice on strategies for for building, migrating, and scaling generative AI & ML workloads in the cloud. You’ll help drive successful business outcomes across a broad set of enterprise customers through your passion for educating, training, designing and building cloud solutions.

As a Senior Applied AI Architect, you will use ML and Generative AI tools, such as Amazon SageMaker, Amazon Bedrock, Amazon Q and other technologies to design, evangelize, and implement state-of-the-art solutions for never-before-solved problems. You’ll help drive successful business outcomes across a broad set of customers through your passion for educating, training, designing and building cloud hosted Generative AI solutions.

You will design and develop generative AI industry solutions that involves large-scale data processing and modeling. You will have responsibility to help define requirements, create solution designs, implement code to these specifications, and support solutions while deployed and used by our industry customers. You will have the opportunity to help shape and execute a strategy to build deep adoption and broad use of AWS within your customers, and you will do this by mobilizing resources within AWS and working with our extensive partner network.

Travel is mostly regional, and is expected to be 15-20%.

Key job responsibilities

 Ensure success in designing, building and migrating applications, software, and services on the AWS platform.
 Interact with customers directly to understand the business problem, help and aid them in implementation of their AI/ML ecosystem
 Educate customers on the value proposition of AWS and showcase the art of possible.
 Participate in deep architectural discussions and design exercises to create world-class solutions built on AWS while ensuring solutions are designed for successful deployment in the cloud.
 Author and contribute to AWS customer-facing publications such as whitepapers, workshops, demos and proof of concepts.
 Build deep relationships with senior technical individuals within customers to enable them to be cloud advocates.
 Capture and share best-practice knowledge amongst the AWS Architect community.

About The Team

Diverse Experiences

AWS values diverse experiences. Even if you do not meet all of the preferred qualifications and skills listed in the job description, we encourage candidates to apply. If your career is just starting, hasn’t followed a traditional path, or includes alternative experiences, don’t let it stop you from applying.

Why AWS?

Amazon Web Services (AWS) is the world’s most comprehensive and broadly adopted cloud platform. We pioneered cloud computing and never stopped innovating — that’s why customers from the most successful startups to Global 500 companies trust our robust suite of products and services to power their businesses.

Inclusive Team Culture

AWS values curiosity and connection. Our employee-led and company-sponsored affinity groups promote inclusion and empower our people to take pride in what makes us unique. Our inclusion events foster stronger, more collaborative teams. Our continual innovation is fueled by the bold ideas, fresh perspectives, and passionate voices our teams bring to everything we do.

Mentorship & Career Growth

We’re continuously raising our performance bar as we strive to become Earth’s Best Employer. That’s why you’ll find endless knowledge-sharing, mentorship and other career-advancing resources here to help you develop into a better-rounded professional.

Work/Life Balance

We value work-life harmony. Achieving success at work should never come at the expense of sacrifices at home, which is why we strive for flexibility as part of our working culture. When we feel supported in the workplace and at home, there’s nothing we can’t achieve.

Basic Qualifications

 5+ years of specific technology domain areas (e.g. software development, cloud computing, systems engineering, infrastructure, security, networking, data & analytics) experience
 3+ years of design, implementation, or consulting in applications and infrastructures experience
 7+ years of IT development or implementation/consulting in the software or Internet industries experience
 Hands on experience architecting and deploying full stack generative AI workloads to production systems.

Preferred Qualifications

 Experience optimizing production generative AI or Hybrid AI workloads for optimal cost, latency, and/or resilience
 PhD in Computer Science with specialization in Machine Learning, Deep Learning, or Natural Language Processing - or - Masters in Computer Science with strong AI/ML focus
 Knowledge of large scale automation and workflow management or equivalent

Amazon is an equal opportunity employer and does not discriminate on the basis of protected veteran status, disability, or other legally protected status.

Our inclusive culture empowers Amazonians to deliver the best results for our customers. If you have a disability and need a workplace accommodation or adjustment during the application and hiring process, including support for the interview or onboarding process, please visit https://amazon.jobs/content/en/how-we-hire/accommodations for more information. If the country/region you’re applying in isn’t listed, please contact your Recruiting Partner.

The base salary for this position ranges from $126,000/year up to $210,400/year. Salary is based on a number of factors and may vary depending on job-related knowledge, skills, and experience. Amazon is a total compensation company. Dependent on the position offered, equity, sign-on payments, and other forms of compensation may be provided as part of a total compensation package, in addition to a full range of medical, financial, and/or other benefits. Applicants should apply via our internal or external career site.


Company - Amazon Web Services Canada, Inc.

Job ID: A2980189",[]
"Staff Backend Engineer, AI",OpenPhone,Canada,Remote,"About the job
For millions of teams working in dozens of industries, day-to-day business gets done on the phone. So why — despite the huge leaps we've taken in design and usability — does most business phone software still look, feel, and act like it was born in the 90s? OpenPhone is changing that.

We’re a new type of business phone with a mission to help people communicate better and be more productive.

We’re backed by Y Combinator and some of the best venture firms around including Tiger Global, Craft Ventures, Slow Ventures, and others. We take pride in providing an exceptional customer experience and a product people love, which is why we’re excited that our customers have rated us the #1 VoIP Provider on G2.

OpenPhone is the modern, sophisticated answer to the clunky, outdated phone systems that have been slowing down businesses for years. With thousands of happy customers and several rounds of funding in just five years, it's safe to say we're onto something big.

About The Role

OpenPhone’s AI capabilities power everything from intelligent call assistants to automated workflows that help thousands of businesses communicate better. As a Staff Backend Engineer, you will own the technical strategy for how we design, build, and operate AI features across the product. You’ll partner closely with leaders across engineering, product, and security to translate ambitious product ideas into scalable, dependable systems. Your architectural choices will shape how every customer experiences AI inside OpenPhone—from the very first trial call to fully deployed agents—and you’ll be trusted to balance cutting-edge innovation with rock-solid reliability.

Things You’ll Do

Own the long-term architecture for AI orchestration frameworks, agent-based workflows, and model lifecycle management.
Lead cross-functional delivery of AI features from proof of concept to production rollout, coordinating engineering, product, design, and CX.
Establish best practices for prompt engineering, evaluation, versioning, observability, and incident response for AI services.
Design and optimize low-latency streaming pipelines for speech and other real-time data when the customer experience demands it.
Drive continuous cost, performance, reliability, and security improvements for models and infrastructure.
Mentor engineers through design reviews, code reviews, and technical coaching, raising the bar for excellence across teams.
Partner with security and platform leaders to ensure data privacy, compliance, and operational excellence.
Stay current on advances in LLMs, agent architectures, and emerging tooling, translating insights into actionable roadmap proposals.

Tech Stack & Tools

Our backend is built on Node using Typescript.
Our AI Infrastructure uses temporal.io, vector DBs, libraries like Langchain and top-tier llm models.
We use Kubernetes on AWS to orchestrate our infrastructure setup and deployment.
The overall architecture is event-driven microservices with RabbitMQ at the center of it.
We use a variety of databases for different purposes: Postgres, Mongo, Elastic, and Redis.
We have the following clients - Web (React), Android and iOS.
We use Kong as our public API Gateway.
Observability Tools: Datadog
Other Tools: Figma, Linear, Notion, and Slack

About You

10+ years of backend or platform engineering experience, including LLM-driven systems in production.
Proven success leading architecture for business-critical services, balancing innovation with operational pragmatism.
Deep knowledge of LLM integration patterns, prompt design, vector search, and agent frameworks.
Expertise in event-driven and streaming architectures; you can reason about concurrency, ordering, and back-pressure under load.
Track record of driving cost optimization, observability, and incident response for AI workloads.
Excellent written and verbal communicator who aligns diverse stakeholders and produces clear, thorough design docs.
Collaborative leader who mentors others, fosters psychological safety, and elevates the entire engineering organization.
Comfortable with ambiguity, you break down complex problems, make informed trade-offs, and deliver iterative value quickly.
Empathetic and customer-focused, you balance technical decisions with user experience and business impact.

Compensation

The annual base salary range for this position is as follow, plus equity and benefits:

SF Bay Area, Los Angeles, Seattle, Portland, Boston, New York, and Washington, DC Metro: $211,000 - $234,000 USD

All other US Locations: $188,000 - $208,000 USD

Canada: $215,000 - $237,000 CAD

The ranges displayed reflect the target for new hire salaries, and within each range, individual pay is determined by your skills and experience, as well as relevant education. Your recruiter can share more and answer questions about the specific salary range during the hiring process.

Salary is just one component of OpenPhone’s total compensation package. Your total rewards package will include equity, extensive medical coverage, a monthly lifestyle stipend, and a flexible PTO policy.

Who We Are

As a fully remote company, we thrive asynchronously as a team. We are curious, ambitious, and dedicated to our work. We value trust above all else, and have a strong bias for action. If you're looking for a place to do your life's work, please get in touch. We'd love to hear from you.

And remember, there's no such thing as a 'perfect' candidate. We're looking for optimists with grit and determination, who are excited to face the challenges of a growing startup. OpenPhone is the type of company where you can grow, and we encourage you to apply for this role even if you don't think you meet all the requirements.

We are committed to creating an inclusive and diverse work environment. It is important that you are able to bring your authentic self to work every day. We do not discriminate on the basis of race, religion, color, national origin, gender, sexual orientation, age, marital status, veteran status, or disability status.",[]
"Member of Technical Staff, Next Generation Agents",Cohere,"Toronto, ON",Remote,"About the job
Who are we?

Our mission is to scale intelligence to serve humanity. We’re training and deploying frontier models for developers and enterprises who are building AI systems to power magical experiences like content generation, semantic search, RAG, and agents. We believe that our work is instrumental to the widespread adoption of AI.

We obsess over what we build. Each one of us is responsible for contributing to increasing the capabilities of our models and the value they drive for our customers. We like to work hard and move fast to do what’s best for our customers.

Cohere is a team of researchers, engineers, designers, and more, who are passionate about their craft. Each person is one of the best in the world at what they do. We believe that a diverse range of perspectives is a requirement for building great products.

Join us on our mission and shape the future!

Why this role?

Agentic LLM systems are being deployed widely across enterprise companies including through Cohere’s North platform. The Next Generation Agents team is exploring the horizon of modeling techniques to improve agent capabilities (e.g., deep-research, learning-from-experience, continual learning, and memory). We work in an empirical-research-driven manner to develop production solutions. Much of the work is based on improving beyond the current state-of-the-art in a setting where we know this will bring value to our customers.

As a part of this team, you will help drive exploration and development of agentic techniques. You will have the opportunity to build the models that power our agentic solutions. This includes developing data-generation techniques for post-training (SFT and RL*) Cohere’s models.

Please Note: We have offices in London, Toronto, San Francisco, and New York, but we also embrace being remote-friendly! There are no restrictions on where you can be located for this role.

As a Member of Technical Staff for Next Generation Agents you will:

Design and develop novel agentic solutions
Improve upon SOTA on hard agentic tasks
Research the next-generation of on-line learning-from-experience self-improvement
Work with partner teams (Reasoning, Post-training, Pre-training, etc.) to improve performance of agentic system
Work with an amazing team of researchers and engineers pushing the boundaries

You May Be a Good Fit If You Have

Strong software engineering skills
Proficiency in Python and have some experience with ML-related code (e.g., pytorch, numpy, etc.)
Experience with LLMs and agentic frameworks
Experience with post-training LLMs (SFT, PEFT, or RL*)
Experience with building synthetic data generation pipelines

If some of the above doesn’t line up perfectly with your experience, we still encourage you to apply! If you want to work really hard on a glorious mission with teammates that want the same thing, Cohere is the place for you.

We value and celebrate diversity and strive to create an inclusive work environment for all. We welcome applicants from all backgrounds and are committed to providing equal opportunities. Should you require any accommodations during the recruitment process, please submit an Accommodations Request Form, and we will work together to meet your needs.

Full-Time Employees At Cohere Enjoy These Perks

🤝 An open and inclusive culture and work environment

🧑‍💻 Work closely with a team on the cutting edge of AI research

🍽 Weekly lunch stipend, in-office lunches & snacks

🦷 Full health and dental benefits, including a separate budget to take care of your mental health

🐣 100% Parental Leave top-up for 6 months for employees based in Canada, the US, and the UK

🎨 Personal enrichment benefits towards arts and culture, fitness and well-being, quality time, and workspace improvement

🏙 Remote-flexible, offices in Toronto, New York, San Francisco and London and co-working stipend

✈️ 6 weeks of vacation

Note: This post is co-authored by both Cohere humans and Cohere technology.",[]
